address,brand,business_legal_name,country,currency,email_address,full_product_description,in_stock,item_number,keyword,listing_id,listing_title,listing_url,offers_count,phone_number,price,product_images,product_sku,seller_name,seller_profile_picture,seller_profile_url,seller_rating,state_province,total_reviews,units_available,zip_code
,InStyler,Robot or human?,,USD,,"Hair Straightening Curling Straightener&Curler Styler 2 In 1 Multi Hair Styling Tool Flat
Features:
1.Adopted infrared heating , fast heating, long life and good temperature stability.
2. Exquisite ceramic plate, smooth and bright, less damage to the hair.
3.Rapidly heating within , when reaching the desired temperature, you can operate it.
4.Thermostatic technology, up to 210 Deg.C, your hair from over-heating.
5. Ergonomic handle gives you a comfortable using experience for its lightweight design.
Product Description:
Package included:
1x Rotating 2-Way Hair Curler Straightener",True,16849973669,instyler,16849973669,InStyler Professional Hair Straightening Iron Curling Iron Straightener&Curler Styler 2 In 1 Multi Hair Styling Tool Flat Iron With Brush,https://www.walmart.com/ip/InStyler-Professional-Hair-Straightening-Iron-Curling-Iron-Straightener-Curler-Styler-2-In-1-Multi-Hair-Styling-Tool-Flat-Iron-With-Brush/16849973669?classType=VARIANT,1,,36.99,https://i5.walmartimages.com/seo/InStyler-Professional-Hair-Straightening-Iron-Curling-Iron-Straightener-Curler-Styler-2-In-1-Multi-Hair-Styling-Tool-Flat-Iron-With-Brush_8871432d-7165-4f8e-8e5e-d33ff43edf11.da615e5ca0a0bd3517ad3d228caf9cb5.jpeg|https://i5.walmartimages.com/asr/544800a0-7a0f-4a97-a04a-a556e04a14f1.171251217383e8be89dab8ec6859160e.jpeg|https://i5.walmartimages.com/asr/152de73a-4703-4a0f-aa94-d92ca311e868.b128dc5c1466e11fcbb756a66fc69394.jpeg|https://i5.walmartimages.com/asr/6a6293dc-7861-41a3-8285-c7596ccb2da2.bae8f579094c39169391f76100ba2a77.jpeg|https://i5.walmartimages.com/asr/233bbb2e-3787-47ed-8e78-574173398890.dbeb7ba3c17a90ecf5b5f51f9c2fccc7.jpeg|https://i5.walmartimages.com/asr/3b563738-cf1f-4bfe-97ff-d197e8659310.ad31d7818b9e8835af925ae710722c22.jpeg|https://i5.walmartimages.com/asr/6767dc3b-a417-43c4-9be2-6afa1a222bd8.fe5c8452e0134af6cc9c19a09f738622.jpeg|https://i5.walmartimages.com/asr/0884bb98-41a8-43b5-90b3-63132fcf42b3.a794ff88992dd40439da26a92274143d.jpeg,,cuichunli,,https://www.walmart.com/seller/cuichunli/B5CD25622BBB4A89BEDFCEA702D9BA66,,,,,
,WXLCISI,Robot or human?,,USD,,"Hair Straightening Curling Straightener&Curler Styler 2 In 1 Hair Styling Tool Flat
Features:
1.Adopted infrared heating , fast heating, long life and good temperature stability.
2. Exquisite ceramic plate, smooth and bright, less damage to the hair.
3.Rapidly heating within , when reaching the desired temperature, you can operate it.
4.Thermostatic technology, up to 210 Deg.C, your hair from over-heating.
5. Ergonomic handle gives you a comfortable using experience for its lightweight design.
Product Description:
Hair Straightening Curling Straightener&Curler Styler 2 In 1 Hair Styling Tool Flat
Material: Plastic
Color: as the picture shows, (Due to the difference between different monitors, the picture may have slight color difference. please make sure you do not mind before ordering, Thank you!)
Package weight: 0g
Package size: 35x15x8.8cm,(Please allow 1-3mm error due to manual measurement. please make sure you do not mind before ordering.)",True,16266913831,instyler,16266913831,"InStyler 2 in 1 Hair Curler Straighter Rotating Iron for Hair Curling and Straighting, Professional Hot Brush Styler Irons Hairdressing Tool with Adjustable",https://www.walmart.com/ip/InStyler-2-1-Hair-Curler-Straighter-Rotating-Iron-Hair-Curling-Straighting-Professional-Hot-Brush-Styler-Irons-Hairdressing-Tool-Adjustable/16266913831?classType=VARIANT,1,,36.99,https://i5.walmartimages.com/seo/InStyler-2-1-Hair-Curler-Straighter-Rotating-Iron-Hair-Curling-Straighting-Professional-Hot-Brush-Styler-Irons-Hairdressing-Tool-Adjustable_be14dfed-8709-4927-8439-bd8d0a15deb1.0cd48e46642c028a339a28b26ace360b.png|https://i5.walmartimages.com/asr/683c52ad-d2aa-4bf6-ba8a-80149743e6be.77541826b515263bf0c1b13614715134.jpeg|https://i5.walmartimages.com/asr/3219296c-e032-43d8-a989-1f9ae68f5974.9f9b80a50106ac4f1b7a61cd91baa431.jpeg|https://i5.walmartimages.com/asr/f57bedc7-d491-4a83-96ba-9857e799ab48.817c26f23b322de9fe2cb9057fbce6ad.jpeg|https://i5.walmartimages.com/asr/d6a86f0a-3be0-4d51-b357-d4e0bd426318.102d4e2ced6b96410c965fe71a3800eb.jpeg|https://i5.walmartimages.com/asr/d3cca23a-3d2d-46c8-a065-c83c52e8930d.f3f982b9ee1a9e70b39415018896f77c.jpeg|https://i5.walmartimages.com/asr/c8d6031d-6f30-4743-8155-7aacf4fba7ad.98cc3e0d7198ded3b68573e8ed44d4f3.jpeg|https://i5.walmartimages.com/asr/f5e9e61a-e28b-47fd-b1c1-d8d25d9aea80.56cc096d9e4d8f79b22ca8bdb07d4665.jpeg,,cuichunli,,https://www.walmart.com/seller/cuichunli/B5CD25622BBB4A89BEDFCEA702D9BA66,,,,,
,InStyler,Robot or human?,,USD,,"Instyler FREESTYLE delivers full styling freedom to create smooth, sculpted or textured looks. The innovative 3D Ceramic Heat delivers multi-dimensional styling power by combining ceramic heated bristles with a ceramic heated barrel. Effortlessly brush through hair to smooth strands, while eliminating frizz and adding shine. Twist the Instyler FREESTYLE to create curls and waves or enhance volume at roots with a simple lift.",True,928084105,instyler,928084105,"Instyler Freestyle Ionic Ceramic Styler, Hair Curling Brush, Hair Straightening Brush",https://www.walmart.com/ip/Instyler-Freestyle-Ionic-Ceramic-Styler-Hair-Curling-Brush-Hair-Straightening-Brush/928084105?classType=REGULAR,1,,32.99,https://i5.walmartimages.com/seo/Instyler-Freestyle-Ionic-Ceramic-Styler-Hair-Curling-Brush-Hair-Straightening-Brush_1644b412-7a10-4483-8896-f2db6e115ba5_1.3aa887c0e316576d0549c8f908e10c6a.jpeg|https://i5.walmartimages.com/asr/85b7d27c-7ebc-4587-b064-d452a21e6009_1.927be01870f578f6b575ff09fefaff12.jpeg|https://i5.walmartimages.com/asr/85e41f4b-7c8e-47a3-a9cf-21810e17b6b0.a7718832bd5bb0a5e7b0f1303ce86746.jpeg|https://i5.walmartimages.com/asr/159bdaa5-c5d7-4abd-8f2d-5bba0a1468cb.07573cdc3116eb4f32d34cab26df3583.jpeg|https://i5.walmartimages.com/asr/2fece478-600e-45d4-9704-db3900c6603f.f798f42e04169b51066476757ec27bfd.jpeg|https://i5.walmartimages.com/asr/13a39032-94bd-4f61-acb7-8d38e4e145a8_1.e133af4b4fee01e329de708dd307f1ac.jpeg|https://i5.walmartimages.com/asr/fdef1140-6bed-44ee-b9ec-8b5e0dddf4cb.0b3f4ce90376d1bbb67746ea34e4d38b.jpeg|https://i5.walmartimages.com/asr/e5aacfcc-1044-4794-a7a7-ea24c22dac25.006ebb6c506ef3960b3439719abcf270.jpeg|https://i5.walmartimages.com/asr/d8446577-884c-4ec0-bd73-5736215aff7c_2.ee4348b01ae70cd5ade21aa4831b2b13.jpeg|https://i5.walmartimages.com/asr/50be2fee-1a60-4066-bfe7-7860f751e812.40fcdd3eef4295bdef4f83f0dec93942.jpeg,,Walmart.com,,https://www.walmart.com/seller/walmart-com/F55CDC31AB754BB68FE0B39041159D63,,,,,
