address,brand,business_legal_name,country,currency,email_address,full_product_description,in_stock,item_number,keyword,listing_id,listing_title,listing_url,offers_count,phone_number,price,product_images,product_sku,seller_name,seller_profile_picture,seller_profile_url,seller_rating,state_province,total_reviews,units_available,zip_code
,InStyler,,,USD,,"Hair Straightening Curling Straightener&Curler Styler 2 In 1 Multi Hair Styling Tool Flat
Features:
1.Adopted infrared heating , fast heating, long life and good temperature stability.
2. Exquisite ceramic plate, smooth and bright, less damage to the hair.
3.Rapidly heating within , when reaching the desired temperature, you can operate it.
4.Thermostatic technology, up to 210 Deg.C, your hair from over-heating.
5. Ergonomic handle gives you a comfortable using experience for its lightweight design.
Product Description:
Package included:
1x Rotating 2-Way Hair Curler Straightener",True,16849973669,instyler,16849973669,InStyler Professional Hair Straightening Iron Curling Iron Straightener&Curler Styler 2 In 1 Multi Hair Styling Tool Flat Iron With Brush,https://www.walmart.com/ip/InStyler-Professional-Hair-Straightening-Iron-Curling-Iron-Straightener-Curler-Styler-2-In-1-Multi-Hair-Styling-Tool-Flat-Iron-With-Brush/16849973669?classType=VARIANT,1,,36.99,https://i5.walmartimages.com/seo/InStyler-Professional-Hair-Straightening-Iron-Curling-Iron-Straightener-Curler-Styler-2-In-1-Multi-Hair-Styling-Tool-Flat-Iron-With-Brush_8871432d-7165-4f8e-8e5e-d33ff43edf11.da615e5ca0a0bd3517ad3d228caf9cb5.jpeg|https://i5.walmartimages.com/asr/6767dc3b-a417-43c4-9be2-6afa1a222bd8.fe5c8452e0134af6cc9c19a09f738622.jpeg|https://i5.walmartimages.com/asr/233bbb2e-3787-47ed-8e78-574173398890.dbeb7ba3c17a90ecf5b5f51f9c2fccc7.jpeg|https://i5.walmartimages.com/asr/0884bb98-41a8-43b5-90b3-63132fcf42b3.a794ff88992dd40439da26a92274143d.jpeg|https://i5.walmartimages.com/asr/152de73a-4703-4a0f-aa94-d92ca311e868.b128dc5c1466e11fcbb756a66fc69394.jpeg|https://i5.walmartimages.com/asr/6a6293dc-7861-41a3-8285-c7596ccb2da2.bae8f579094c39169391f76100ba2a77.jpeg|https://i5.walmartimages.com/asr/544800a0-7a0f-4a97-a04a-a556e04a14f1.171251217383e8be89dab8ec6859160e.jpeg|https://i5.walmartimages.com/asr/3b563738-cf1f-4bfe-97ff-d197e8659310.ad31d7818b9e8835af925ae710722c22.jpeg,,cuichunli,,,,,,,
,WXLCISI,,,USD,,"Hair Straightening Curling Straightener&Curler Styler 2 In 1 Hair Styling Tool Flat
Features:
1.Adopted infrared heating , fast heating, long life and good temperature stability.
2. Exquisite ceramic plate, smooth and bright, less damage to the hair.
3.Rapidly heating within , when reaching the desired temperature, you can operate it.
4.Thermostatic technology, up to 210 Deg.C, your hair from over-heating.
5. Ergonomic handle gives you a comfortable using experience for its lightweight design.
Product Description:
Hair Straightening Curling Straightener&Curler Styler 2 In 1 Hair Styling Tool Flat
Material: Plastic
Color: as the picture shows, (Due to the difference between different monitors, the picture may have slight color difference. please make sure you do not mind before ordering, Thank you!)
Package weight: 0g
Package size: 35x15x8.8cm,(Please allow 1-3mm error due to manual measurement. please make sure you do not mind before ordering.)",True,16266913831,instyler,16266913831,"InStyler 2 in 1 Hair Curler Straighter Rotating Iron for Hair Curling and Straighting, Professional Hot Brush Styler Irons Hairdressing Tool with Adjustable",https://www.walmart.com/ip/InStyler-2-1-Hair-Curler-Straighter-Rotating-Iron-Hair-Curling-Straighting-Professional-Hot-Brush-Styler-Irons-Hairdressing-Tool-Adjustable/16266913831?classType=VARIANT,1,,36.99,https://i5.walmartimages.com/seo/InStyler-2-1-Hair-Curler-Straighter-Rotating-Iron-Hair-Curling-Straighting-Professional-Hot-Brush-Styler-Irons-Hairdressing-Tool-Adjustable_be14dfed-8709-4927-8439-bd8d0a15deb1.0cd48e46642c028a339a28b26ace360b.png|https://i5.walmartimages.com/asr/683c52ad-d2aa-4bf6-ba8a-80149743e6be.77541826b515263bf0c1b13614715134.jpeg|https://i5.walmartimages.com/asr/3219296c-e032-43d8-a989-1f9ae68f5974.9f9b80a50106ac4f1b7a61cd91baa431.jpeg|https://i5.walmartimages.com/asr/f57bedc7-d491-4a83-96ba-9857e799ab48.817c26f23b322de9fe2cb9057fbce6ad.jpeg|https://i5.walmartimages.com/asr/d6a86f0a-3be0-4d51-b357-d4e0bd426318.102d4e2ced6b96410c965fe71a3800eb.jpeg|https://i5.walmartimages.com/asr/d3cca23a-3d2d-46c8-a065-c83c52e8930d.f3f982b9ee1a9e70b39415018896f77c.jpeg|https://i5.walmartimages.com/asr/c8d6031d-6f30-4743-8155-7aacf4fba7ad.98cc3e0d7198ded3b68573e8ed44d4f3.jpeg|https://i5.walmartimages.com/asr/f5e9e61a-e28b-47fd-b1c1-d8d25d9aea80.56cc096d9e4d8f79b22ca8bdb07d4665.jpeg,,cuichunli,,,,,,,
,InStyler,,,USD,,"Instyler FREESTYLE delivers full styling freedom to create smooth, sculpted or textured looks. The innovative 3D Ceramic Heat delivers multi-dimensional styling power by combining ceramic heated bristles with a ceramic heated barrel. Effortlessly brush through hair to smooth strands, while eliminating frizz and adding shine. Twist the Instyler FREESTYLE to create curls and waves or enhance volume at roots with a simple lift.",True,928084105,instyler,928084105,"Instyler Freestyle Ionic Ceramic Styler, Hair Curling Brush, Hair Straightening Brush",https://www.walmart.com/ip/Instyler-Freestyle-Ionic-Ceramic-Styler-Hair-Curling-Brush-Hair-Straightening-Brush/928084105?classType=REGULAR&athbdg=L1600,1,,32.99,https://i5.walmartimages.com/seo/Instyler-Freestyle-Ionic-Ceramic-Styler-Hair-Curling-Brush-Hair-Straightening-Brush_1644b412-7a10-4483-8896-f2db6e115ba5_1.3aa887c0e316576d0549c8f908e10c6a.jpeg|https://i5.walmartimages.com/asr/85b7d27c-7ebc-4587-b064-d452a21e6009_1.927be01870f578f6b575ff09fefaff12.jpeg|https://i5.walmartimages.com/asr/85e41f4b-7c8e-47a3-a9cf-21810e17b6b0.a7718832bd5bb0a5e7b0f1303ce86746.jpeg|https://i5.walmartimages.com/asr/159bdaa5-c5d7-4abd-8f2d-5bba0a1468cb.07573cdc3116eb4f32d34cab26df3583.jpeg|https://i5.walmartimages.com/asr/2fece478-600e-45d4-9704-db3900c6603f.f798f42e04169b51066476757ec27bfd.jpeg|https://i5.walmartimages.com/asr/13a39032-94bd-4f61-acb7-8d38e4e145a8_1.e133af4b4fee01e329de708dd307f1ac.jpeg|https://i5.walmartimages.com/asr/fdef1140-6bed-44ee-b9ec-8b5e0dddf4cb.0b3f4ce90376d1bbb67746ea34e4d38b.jpeg|https://i5.walmartimages.com/asr/e5aacfcc-1044-4794-a7a7-ea24c22dac25.006ebb6c506ef3960b3439719abcf270.jpeg|https://i5.walmartimages.com/asr/d8446577-884c-4ec0-bd73-5736215aff7c_2.ee4348b01ae70cd5ade21aa4831b2b13.jpeg|https://i5.walmartimages.com/asr/50be2fee-1a60-4066-bfe7-7860f751e812.40fcdd3eef4295bdef4f83f0dec93942.jpeg,,Walmart.com,,,,,,,
,InStyler,,,USD,,"Revolutionize your hairstyling routine with the InStyler Ionic Pro 4-in-1 Hair Straightener, Curling Iron, Hot Brush, and Flat Iron. This versatile tool combines four styling functions in one, allowing you to achieve smooth, sleek straight hair or voluminous curls effortlessly. The advanced Dual Ionic Ceramic Technology helps reduce frizz while adding shine and body, ensuring your hair stays healthy and burn-free during styling.

With multiple heat settings up to 400°F, the InStyler Ionic Pro is designed to work on all hair types, from fine to coarse, giving you full control over your styling preferences. Its cool touch ionic bristles allow for tangle-free, safe styling, while the non-slip rubber grip and 360-degree swivel cord provide comfort and ease of use. Whether you want to create straight, smooth hair or bouncy curls, this all-in-one tool will meet your every need.

Plus, its automatic safety shut-off feature gives you peace of mind, ensuring the device turns off after use. Compact and portable, the InStyler Ionic Pro is ideal for travel, allowing you to maintain your style wherever you go.",True,39804291,instyler,39804291,InStyler Ionic Pro Hair Straightener Ceramic Flat Iron Hair Dryer Brush Curling Iron 4 in 1 Styling Tool,https://www.walmart.com/ip/InStyler-Ionic-Pro-Hair-Straightener-Ceramic-Flat-Iron-Hair-Dryer-Brush-Curling-Iron-4-in-1-Styling-Tool/39804291?classType=REGULAR,1,,20.89,https://i5.walmartimages.com/seo/InStyler-Ionic-Pro-Hair-Straightener-Ceramic-Flat-Iron-Hair-Dryer-Brush-Curling-Iron-4-in-1-Styling-Tool_0ebab82a-a44d-4a43-a262-254df5374cd4.695879061acfc86126b35c937c2f1140.jpeg|https://i5.walmartimages.com/asr/8b4904d3-018c-4f12-9144-e8c369012c23.ba9fa514e5acffff8c290054bc2fbb2b.jpeg|https://i5.walmartimages.com/asr/188e6bf1-173f-4c10-a329-e94516069ba6.5338e764da70f7d5405aeaba1335ca57.jpeg|https://i5.walmartimages.com/asr/650d2307-eaa6-47f1-8046-c6fc603ad1be.1079e3323e592a4727b3888f1fd23000.jpeg|https://i5.walmartimages.com/asr/19105b1d-5a7a-427b-b3cc-afbe6cc16620.7002db50ac3e2163a90baba00e6bfc90.jpeg|https://i5.walmartimages.com/asr/dd72b7b4-aa0a-4388-92cb-600814b14035.8328f64ddfbeb7a89fa97d718b1a4fc8.jpeg|https://i5.walmartimages.com/asr/ebab8aff-e949-41c2-8198-4cc7d9325e69.00322cf0165e6e24211a5d99bf75901b.jpeg|https://i5.walmartimages.com/asr/49de7e13-6ec5-4d09-9fb7-2880a379b051.474d5ac57882ffd059856b71713ce76b.jpeg,,Ammery Essence,,,,,,,
,InStyler,,,USD,,"The Tulip auto curler's innovative automatic curling technology lets you achieve perfect curls and waves every time without tangling or damaging hair. Curling your hair has never been so fast and easy with the simple tap of a button, you can have beachy waves in just 3 seconds, soft curls in 8 seconds and striking tight curls in 12 seconds. With the unique open barrel design of the Tulip, your hair is visible and exposed at all times, preventing hair from getting tangled and becoming jammed in the unit. The open design and ample space surrounding the barrel also makes it easy for the Tulip to curl long and thick hair. The lightweight ergonomic design of the Tulip makes curling your hair easy and comfortable. Throughout the entire styling process, the Tulip is held in a natural vertical position with a relaxed grip, putting no strain or stress on your hand or wrist.





Open ceramic barrel designed with anti-tangle technology





2-way rotation with 3 rotation settings to curl left, curl right or alternate





3 heat settings range from 350 to 430 degrees Fahrenheit to accommodate all hair types





3 timer settings to achieve a variety of looks from beachy waves to tight striking curls





Safety guard for burn-free styling",True,17226668307,instyler,17226668307,Instyler Tulip Auto Curler Automatic Curling Tong Iron Wave Machine,https://www.walmart.com/ip/Instyler-Tulip-Auto-Curler-Automatic-Curling-Tong-Iron-Wave-Machine/17226668307?classType=REGULAR,1,,59.07,https://i5.walmartimages.com/seo/Instyler-Tulip-Auto-Curler-Automatic-Curling-Tong-Iron-Wave-Machine_8f0eda55-5b72-434b-ba53-87ea5782767c.510f045957e804f1df87eb8fa3a168b5.jpeg|https://i5.walmartimages.com/asr/2679e236-1a74-4003-b565-5983d4c1fa19.64db4232f41038cd13f9efed86d73eeb.jpeg|https://i5.walmartimages.com/asr/f5749666-beee-4f24-ac38-23d9a2149a9d.719fb6601c2b95a95965e0f4e50b93ee.jpeg|https://i5.walmartimages.com/asr/a43f699b-786e-42ea-8127-8e4fc085cf15.d2358edc835b232a021bdc440fab7d6b.jpeg|https://i5.walmartimages.com/asr/c38a3a92-a1c8-4dcf-bb92-1844d2c907f2.873097d349b4629dd46fb6a0db5c87ed.jpeg|https://i5.walmartimages.com/asr/1e484c86-db74-4ed3-975e-86fbfd2fd926.ec1bc7f2281770c0f03d2ca1bb6f823b.jpeg|https://i5.walmartimages.com/asr/453b57ff-75f0-4259-8a4d-c6fbcbc5ae35.fa334cf0e8ebd489abfdb5f875e9cc04.jpeg|https://i5.walmartimages.com/asr/209b56c2-c6d5-4f48-b717-09f7901f9834.c6512f5d0fe048b2f279536ebefbadec.jpeg|https://i5.walmartimages.com/asr/3b9f282f-99eb-480e-8f9c-d0b7d9a5700b.3786a2283aba0088c966971188b91aa0.jpeg|https://i5.walmartimages.com/asr/23a3cd98-283a-4082-a25f-64d120c32e45.9f54f7085fb314477acfbd217f08fac3.jpeg,,Hongyuang CO.,,,,,,,
,KeJieShunCheng,,,USD,,"The 2 in 1 Multi - Functional Hairbrush is a revolutionary styling tool that combines the capabilities of straightening and curling into one convenient device. Say goodbye to the hassle of juggling multiple hair styling tools, as this innovative product streamlines your haircare routine.​ Designed with precision, the hairbrush features a unique barrel and bristle configuration. The bristles are carefully engineered to glide smoothly through your hair, detangling it gently while the heating elements work their magic. The instyler Dual Purpose Automatic Straightening or Curling Magic mechanism is truly a game - changer. With a simple flick of the wrist, you can transform your hair from straight to wavy or vice versa.​ This professional - grade hot brush styling flat iron hairdressing tool comes equipped with an adjustable heater. Whether you have fine, delicate hair or thick, coarse locks, you can customize the temperature to suit your hair type. The temperature range typically spans from a gentle heat suitable for sensitive hair to a higher heat setting for those with more stubborn curls or waves. This ensures that you can achieve the perfect style without causing damage to your precious tresses.​ The device heats up rapidly, saving you valuable time in the morning rush. It also has a built - in safety feature, such as an automatic shut - off after a certain period of inactivity, giving you peace of mind while using it. The ergonomic handle provides a comfortable grip, allowing for easy maneuverability around your head, ensuring that you can reach every strand with ease.",True,15541601778,instyler,15541601778,"2-in-1 Multi-Function Hair Brush (Straightening and Curling), instyler Dual Purpose Automatic Straightening or Curling Magic, Professional Hot Brush Styling Flat Iron Hairdressing Tool",https://www.walmart.com/ip/2-in-1-Multi-Function-Hair-Brush-Straightening-Curling-instyler-Dual-Purpose-Automatic-Straightening-Curling-Magic-Professional-Hot-Brush-Styling-Fla/15541601778?classType=REGULAR,1,,36.99,https://i5.walmartimages.com/seo/2-in-1-Multi-Function-Hair-Brush-Straightening-Curling-instyler-Dual-Purpose-Automatic-Straightening-Curling-Magic-Professional-Hot-Brush-Styling-Fla_c08f80fd-cd89-49f1-9612-c94e3948448e.891ea222a317d546508ac7714432d84f.jpeg|https://i5.walmartimages.com/asr/f57bedc7-d491-4a83-96ba-9857e799ab48.817c26f23b322de9fe2cb9057fbce6ad.jpeg|https://i5.walmartimages.com/asr/683c52ad-d2aa-4bf6-ba8a-80149743e6be.77541826b515263bf0c1b13614715134.jpeg|https://i5.walmartimages.com/asr/c8d6031d-6f30-4743-8155-7aacf4fba7ad.98cc3e0d7198ded3b68573e8ed44d4f3.jpeg|https://i5.walmartimages.com/asr/eb6488c0-484f-4b70-a38e-89dde5cf9ebd.39938c61a142a3b4ec97a93231e7cef9.jpeg|https://i5.walmartimages.com/asr/008ac0d4-17c9-4452-a986-5840d588c9b1.c6403ca6f18ebd4e7d5932e6fbf5be1b.png|https://i5.walmartimages.com/asr/e1efac5f-805e-43b7-9ec8-8b8243697a80.d94a8b3bf233a08f6782a8bb403919f3.jpeg|https://i5.walmartimages.com/asr/57b89f54-b129-411a-bbad-4be0a0aa476a.2ee92b4fd55110d4dfd46c9043caf1e3.jpeg|https://i5.walmartimages.com/asr/d6a86f0a-3be0-4d51-b357-d4e0bd426318.102d4e2ced6b96410c965fe71a3800eb.jpeg|https://i5.walmartimages.com/asr/8b7d310e-aeba-4d49-b51f-b1f9bff5651c.5a20b79a9f4f004a4bf3190f5eb24a51.jpeg|https://i5.walmartimages.com/asr/75aae738-072c-45c1-b59e-eabd7190f88a.a43dccf5ae3987ec49e7473a71f2fd5e.jpeg|https://i5.walmartimages.com/asr/5213d0e2-38a6-410f-849c-86a10518c6fb.d65e987fbcb4743238f6a5b483ed3ace.jpeg|https://i5.walmartimages.com/asr/3219296c-e032-43d8-a989-1f9ae68f5974.9f9b80a50106ac4f1b7a61cd91baa431.jpeg|https://i5.walmartimages.com/asr/88d14f3a-a6d3-417a-9c8e-a11d43a182d0.b9abe342c08b6f846a182d0ddad634f4.jpeg,,YangCo.Ltd,,,,,,,
,InStyler,,,USD,,"The Instyler Tulip Auto Curler is very easy and comfortable to use with its lightweight Design. It has an open barrel design, so you can always see what you are doing, preventing it from getting tangled. The sufficient space surrounding the barrel also makes it easy to curl even the longest, thickest hair. It has integrated No Burn safety guards that make certain the heated barrel is safely contained well within the Instyler Tulip Auto Curler body, ensuring it should never come into contact with your ears, neck or scalp. Its Tap Button Control creates the perfect curl every time and its three heat and timer settings so it works for any type of hair in just moments. The Instyler Tulip Auto Curlers innovative automatic curling technology lets you relax while it does all the work. With its two-way rotation you don't need to hold it at funny angles. This great innovative curler has a high quality 22mm Tourmaline Ceramic Barrel for ease of use and salon quality results. Creating frizz-free shiny waves and curls. The Tourmaline Ceramic Barrel will gently heat up your hair without pulling or tugging, reducing breakage and damage.Features: & Perfect curls and waves in 3 seconds every time! & 2-Way auto rotation curls left & right & Its Open Barrel design ensures you always see what you are doing & Tap button automatic operation & 3 rotation settings A - you control the direction & 3 timer settings - you can choose from tight curls or beachy waves & 3 heat settings up to 220 C - perfect for fine, medium & thick hair & Automatic safety shut off & CE Approved & 3m professional swivel cord & Anti tangle technology & No burn safety guard & Tourmaline ceramic barrel for gentle, no frizz styling



Package Contents:



1 x Instyler Tulip Auto Curler





ts Open Barrel design ensures you always see what you are doing





3 rotation settings - you control the direction





3 timer settings - you can choose from tight curls or beachy waves





3 heat settings up to 220 C - perfect for fine, medium & thick hair





Anti tangle technology",True,17302467305,instyler,17302467305,InStyler Instyler Tulip Auto Curler Automatic Curling Tong Iron Wave...,https://www.walmart.com/ip/InStyler-Instyler-Tulip-Auto-Curler-Automatic-Curling-Tong-Iron-Wave/17302467305?classType=REGULAR,1,,59.07,https://i5.walmartimages.com/seo/InStyler-Instyler-Tulip-Auto-Curler-Automatic-Curling-Tong-Iron-Wave_5af83c26-70b4-4df9-89b9-61d1d81fc3d8.9d0d42da7f473026890efd7500b42a8a.jpeg|https://i5.walmartimages.com/asr/9bf2efc9-e10f-44f2-92c4-7cdb2a08ccb6.ae0705305361c9cf2385619583c38ba8.jpeg|https://i5.walmartimages.com/asr/8edd722a-484b-4f00-a868-6ead296a4178.ab0fdc263bfd3cefee12eeee8a75c18e.jpeg|https://i5.walmartimages.com/asr/a1852bbc-e0f9-47e2-a474-692eec605670.29fcb01a6a5d075ddc3b31175da6c46f.jpeg|https://i5.walmartimages.com/asr/6c324177-e3f8-4fed-bc70-95bc056ceaef.254d19262ad2c4b49f9cd9c0a9a584dd.jpeg|https://i5.walmartimages.com/asr/23a97fa1-9378-4980-9262-767cd0b9a91f.41a6338d64bd2dcc5dbf49899865d8fa.jpeg|https://i5.walmartimages.com/asr/7c574dad-fa3b-4ec7-97d1-c2fb80fc97e0.88053da50f9efdc5bf6e21fe96a7c924.jpeg|https://i5.walmartimages.com/asr/4ee0f040-405a-4b72-a044-fbbb0a1239c7.de41675d01012a0c96de3ebd867960de.jpeg|https://i5.walmartimages.com/asr/69c99648-e864-4998-a3f6-c9b7bb098c18.c9863cbbfe60d69eb3c4a801b418adc6.jpeg|https://i5.walmartimages.com/asr/59f4dabf-feff-4e69-b010-e426ad8cc3fd.c4e9f5844be370bff06b8f6a6da8da5f.jpeg,,Hongyuang CO.,,,,,,,
,InStyler,,,USD,,"Features:




1.Adopted infrared heating , fast heating, long life and good temperature stability.




2. Exquisite ceramic plate, smooth and bright, less damage to the hair.




3.Rapidly heating within , when reaching the desired temperature, you can operate it.




4.Thermostatic technology, up to 210 Deg.C, your hair from over-heating.




5. Ergonomic handle gives you a comfortable using experience for its lightweight design.




Product Description:




Hair Straightening Curling Straightener&Curler Styler 2 In 1 Hair Styling Tool Flat




Material: Plastic




Color: as the picture shows




Package size: 35x15x8.8cm",True,16685669308,instyler,16685669308,"InStyler 2 in 1 Rotating Hair Curling Iron for Curling and Straightening Hair, Professional Hot Brush Hairdressing Tool with Adjustable Temperature",https://www.walmart.com/ip/InStyler-2-in-1-Rotating-Hair-Curling-Iron-for-Curling-and-Straightening-Hair-Professional-Hot-Brush-Hairdressing-Tool-with-Adjustable-Temperature/16685669308?classType=REGULAR,1,,37.79,https://i5.walmartimages.com/seo/InStyler-2-in-1-Rotating-Hair-Curling-Iron-for-Curling-and-Straightening-Hair-Professional-Hot-Brush-Hairdressing-Tool-with-Adjustable-Temperature_5b153f81-12f4-45ae-abb0-7e8f39cf37bd.c2b49f1cfd11f78a73e161acbd0110ad.jpeg|https://i5.walmartimages.com/asr/45c52ad7-67c5-4866-a35a-318cce6c8a75.b26401efa5386757b163dc97ff3ae4b7.jpeg|https://i5.walmartimages.com/asr/bb890cd9-1642-42f7-b140-60bc1afa23a2.94c9fcd216ad2689ece1f1242734d20b.jpeg|https://i5.walmartimages.com/asr/4c2d9d58-6fc5-45ed-abf0-d54ad114f50c.0c10baa29056fd3b57d9b0065b4b9db3.jpeg|https://i5.walmartimages.com/asr/fb5af930-1dba-4c6d-ae45-665cc3c09b65.c3fcb894b7f5f49923f2191d896fe3c1.jpeg|https://i5.walmartimages.com/asr/e5632c68-a5b3-4b50-bf3f-cb6b5d53d8a9.d8aa94cbd9eb4aef8f6a229db7a47dfd.jpeg,,cuichunli,,,,,,,
,KIPOZI,,,USD,,"We are committed to create some perfect and practical hair tools to our lovely beauties,leading you to a comfortable natural quality life. You will truly love yourself and be confidently beautiful! The thermal curling brush use advanced PTC heat technology for even efficient heating. Only takes about 30 seconds to heat up, the hair brush curler saves you time during your morning rush. The LCD digital display of thermal hair brush has multiple temperature settings from 180°F up to 450°F to meet all hair types' styling needs. This hot brush styler curling brush has a 60-minute auto shut-off for safety, a 360°swivel cord for easy use and 100-240V dual voltage for travel convenience. With our KIPOZI thermal curling brush for healthy hair, leaving your hair looking healthy and shiny. Say goodbye to frizzy hair and hello to long-lasting curls!",True,666934596,instyler,666934596,"KIPOZI 1.25"" Thermal Brush, Curling Iron Brush, Thermal Round Brush, LCD Display with 16 Adjustable Temperature, Auto Shut-Off, Black",https://www.walmart.com/ip/KIPOZI-1-25-Thermal-Brush-Curling-Iron-Brush-Thermal-Round-Brush-LCD-Display-with-16-Adjustable-Temperature-Auto-Shut-Off-Black/666934596?classType=VARIANT&athbdg=L1600,1,,19.69,https://i5.walmartimages.com/seo/KIPOZI-1-25-Thermal-Brush-Curling-Iron-Brush-Thermal-Round-Brush-LCD-Display-with-16-Adjustable-Temperature-Auto-Shut-Off-Black_f0a48b2d-a49f-421e-afa2-e83ddd245a4c.38f28926d2eeb9b9fedf63b7cd9dbc11.png|https://i5.walmartimages.com/asr/ee93c8df-cda7-45ec-b13d-1030c8f78993.fd8033e75673f61ebe3178e0e458d788.png|https://i5.walmartimages.com/asr/3786398c-d98a-43ab-a188-a028b024e66f.afdfd5bcfc5d33b3f2ae6b08672585fc.png|https://i5.walmartimages.com/asr/0272ab84-e2cb-4e1a-ad67-59e8763d251a.4b03f76d3b9f7026142248ddd371db55.png|https://i5.walmartimages.com/asr/3a89d2d9-5754-4bec-a76d-5593b4ca0967.62814744d6761ea9b3d6a96bc2adb308.png|https://i5.walmartimages.com/asr/921adb3c-d102-41a4-8420-cc1dc3422cf0.123fcfd7257100fe5fb604dc0ee58372.png|https://i5.walmartimages.com/asr/09a80146-a6a6-4990-b917-933d0c698875.40b45133e4ccb2b234699bd85cdad14d.png,,KIPOZI,,,,,,,
,Fakiya,,,USD,,"The Fakiya 5-in-1 curling iron set: dry, curl, straighten, volume, and control frizz—all in one! . The rotating blow dryer mode dries hair faster than traditional hair dryers, while the automatic curling iron mode uses a 55°C constant-temperature ceramic barrel to automatically wrap hair around the strands, creating long-lasting, bouncy curls. Innovative anti-frizz ion technology releases negative ions to smooth frizz, while intelligent temperature control and a honeycomb mesh shield for even heat dissipation effectively reduce the risk of heat damage. Whether you're styling wet hair to prevent frizz, creating volume and a high crown for fine hair, or smoothing and smoothing split ends for coarse hair, the Spitcale 5-in-1 Smart Hair Dryer is the perfect solution. It features dual overheat protection and burn-resistant teeth (",True,17415166024,instyler,17415166024,"Fakiya 5-in-1 Curling Iron Set: Automatic Curler (Ceramic Coated), 3 Adjustable Modes, Hot Air Brush - Quick Dry, Anti-Frizz",https://www.walmart.com/ip/Fakiya-5-in-1-Curling-Iron-Set-Automatic-Curler-Ceramic-Coated-5-Adjustable-Modes-Hot-Air-Brush-Quick-Dry-Anti-Frizz/17415166024?classType=VARIANT,1,,39.8,https://i5.walmartimages.com/seo/Fakiya-5-in-1-Curling-Iron-Set-Automatic-Curler-Ceramic-Coated-5-Adjustable-Modes-Hot-Air-Brush-Quick-Dry-Anti-Frizz_6df912e5-4427-421c-82e9-f9d4a10bb449.c1955896c94d1912c1da5e39b5e09d7d.jpeg|https://i5.walmartimages.com/asr/d1ad2a40-ab9c-4056-bc73-fefb4eb5aa33.69056a055056cbf773978d24e91053de.jpeg|https://i5.walmartimages.com/asr/5c749960-3da7-4f60-a2f9-591a74916368.3db16eca6449bcf6fa1e352973ed0128.jpeg|https://i5.walmartimages.com/asr/3179442d-9dfb-4aef-a8c5-98157178f16f.43ba6b78dfb2c03670c63e3971b7f302.jpeg|https://i5.walmartimages.com/asr/7741d175-b698-435d-addb-06fcc68ba7f2.da8b993f550ede3e742b7ed734e3c197.jpeg|https://i5.walmartimages.com/asr/09e8a8ee-43a6-4bfe-bc55-d9340f83bffd.f2845751bc51834c9869b2ef580976c2.jpeg|https://i5.walmartimages.com/asr/fa13260b-f3d2-4d9f-b334-2a26090770b5.7bc817935f8c0951dfa1eded3d0e7a67.jpeg,,Fangjing,,,,,,,
